######
#
# SYS
#
#####
#
# o diretorio /SYS eh utilizado para exportar informacoes sobre o sistema
# para os processos/programas atraves de um sistema de arquivos SYSFS
# 
# o diretorio /SYS utiliza do sistema de arquivos SYSFS
#
# o aplicativo UDEV se comunica com o SYSFS para gerenciar de forma
# dinamica os dispositivos que estao conectados no computador.
# 
# sistema de arquivos virtual adotado pelo diretorio /sys.
#
# as informacoes organizadas de forma hierarquisadas.
#
drwxr-xr-x   2 root root 0 Jun 13 11:29 block	- dispositivos de blocos (HD/pendrive)
lrwxrwxrwx 1 root root 0 Jun 12 08:36 sda->../devices/pci0000:00/0000:00:1f.2/ata1/host0/target0:0:0/0:0:0:0/block/sda
lrwxrwxrwx 1 root root 0 Jun 12 08:36 sdb->../devices/pci0000:00/0000:00:1f.2/ata2/host1/target1:0:0/1:0:0:0/block/sdb
lrwxrwxrwx 1 root root 0 Jun 13 11:25 sr0->../devices/pci0000:00/0000:00:1f.2/ata3/host2/target2:0:0/2:0:0:0/block/sr0

drwxr-xr-x  25 root root 0 Jun 13 11:29 bus	- barramento
drwxr-xr-x 5 root root 0 Jun 13 11:34 pci
drwxr-xr-x 4 root root 0 Jun 13 11:34 pci_express
drwxr-xr-x 4 root root 0 Jun 13 11:34 scsi
drwxr-xr-x 4 root root 0 Jun 13 11:34 serio

drwxr-xr-x  45 root root 0 Jun 13 11:29 class	- representacao de cada dispositivo
drwxr-xr-x 2 root root 0 Jun 13 11:11 mem
drwxr-xr-x 2 root root 0 Jun 12 08:36 misc
drwxr-xr-x 2 root root 0 Jun 12 08:36 net

drwxr-xr-x   4 root root 0 Jun 13 11:29 dev

drwxr-xr-x  14 root root 0 Jun 13 11:29 devices	- devices conectados no computador
drwxr-xr-x 21 root root 0 Jun 12 08:36 platform
drwxr-xr-x 13 root root 0 Jun 12 08:36 pnp0
drwxr-xr-x  5 root root 0 Jun 12 08:36 power
drwxr-xr-x  3 root root 0 Jun 12 08:36 software
drwxr-xr-x  9 root root 0 Jun 12 08:36 system

drwxr-xr-x   5 root root 0 Jun 13 11:29 firmware

drwxr-xr-x   7 root root 0 Jun 13 11:29 fs	- sistemas de arquivos que foram carregados.

drwxr-xr-x   2 root root 0 Jun 13 11:29 hypervisor
drwxr-xr-x   8 root root 0 Jun 13 11:29 kernel

drwxr-xr-x 159 root root 0 Jun 13 11:29 module	- modulos que foram carregados.

drwxr-xr-x   2 root root 0 Jun 13 11:29 power

######
#
# PROC
#
#####
#
# informacoes sobre o hardware do computador.
#
# -r--r--r--  1 root        root                      0 Jun 13 09:32 cmdline
# -r--r--r--  1 root        root                      0 Jun 13 09:32 cpuinfo
# -r--r--r--  1 root        root                      0 Jun 13 09:32 devices
# -r--r--r--  1 root        root                      0 Jun 13 09:32 dma
# -r--r--r--  1 root        root                      0 Jun 13 09:32 interrupts
# -r--r--r--  1 root        root                      0 Jun 13 09:32 ioports
# -r--r--r--  1 root        root                      0 Jun 13 09:32 meminfo
# -r--r--r--  1 root        root                      0 Jun 13 09:32 modules
# dr-xr-xr-x  1 root        root                      0 Jun 12 08:36 sys
#
# /proc/cmdline - arquivo que contem informacoes que sao repassadas para o kernel
# durante o boot
#	BOOT_IMAGE=/boot/vmlinuz-3.16.0-4-amd64 root=UUID=e1238fef-ebe3-42bf-8038-333dca18cbd3 ro quiet
#
# /proc/cpuinfo - informacoes sobre o processador do computador. Informacoes divididas de acordo com o
# numero do nucleo do processador. No computadores de hoje, um processador pode ter mais de um nucleo.
#
# /proc/devices - informacoes sobre os devices que estao conectados no computador.
#
# /proc/interrupts - interrupcoes utilizadas pelo computador
#
# /proc/ioports - portas logicas que estao sendo utilizadas no computador.
#
# /proc/meminfo - informacoes sobre a utilizacao da memoria, como por exemplo, memoria sendo utilizada,
# memoria livre, memoria swap e outras informacoes.
#
# /proc/modules - modulos carregados e sendo utilizados pelo kernel

######
#
# DEV
#
######
#
# utiliza o sistema de arquivos tmpfs
#
# armazena informações sobre os dispositivos que estao
# conectados no computador.
#
# dispositivos de armazenamento (/dev/hdXY, /dev/sdXY)
#
# trabalha junto com o UDEV para manter atualizado
# o conteudo do diretorio.

######
#
# MODPROBE
#
#####
#
# o comando MODPROBE tem por objetivo o de adicionar ou remover
# um determinado modulo do kernel.
#
# inserindo um modulo no kernel
#
# o comando modprobe possibilita adicionar um determinado
# modulo ao kernel e se por acaso for necessario adicionar
# outro modulo pois existe uma interdependecia, esse outro
# modulo sera adicionado.
#
cosmo@debian:~/myProject/lpi$ sudo modprobe fan

# utilizando a opcao -r, eh possivel remover um determinado
# modulo do kernel.
#
cosmo@debian:~/myProject/lpi$ sudo modprobe -r fan

# somente foi possivel remover o modulo fan pois nenhum
# outro modulo depende deste modulo. No exemplo abaixo,
# nao esta sendo possivel remover o moduloe thermal_sys
# pois esse modulo esta sendo utilizado por outros modulos.
#
cosmo@debian:~/myProject/lpi$ sudo modprobe -r thermal_sys
modprobe: FATAL: Module thermal_sys is in use.

# foi possivel obter as informacoes em relacao a dependencia
# atraves do comando lsmod
#
thermal_sys            27642  6 fan,video,intel_powerclamp,thermal,processor,x86_pkg_temp_thermal

######
#
# LSMOD
#
#####
#
# este comando lista os modulos que foram carregados e estao sendo
# utilizados. Alem disso, eh possivel visualizar as interdependencia
# entre os modulos carregados.
#
# no exemplo abaixo, o modulo THERMAL_SYS eh utilizado por uma serie
# de outros modulos, como por exemplo, fan. Nao eh possivel desabilitar
# o modulo THERMAL_SYS pois outros moduloes depende dele.
#
Module                  Size  Used by
thermal_sys            27642  6 fan,video,intel_powerclamp,thermal,processor,x86_pkg_temp_thermal
(...)

######
#
# LSPCI
#
#####
#
# o comando LSPCI exibe os dispositivos PCI que estao conectados no computador.
#
# atraves do comando "lspci" eh possivel visualizar uma seria de informacoes
# de forma resumida dos dispositivos PCI conectados no computador.
# 
00:00.0 Host bridge: Intel Corporation 4th Gen Core Processor DRAM Controller (rev 06)
00:01.0 PCI bridge: Intel Corporation Xeon E3-1200 v3/4th Gen Core Processor PCI Express x16 Controller (rev 06)
00:14.0 USB controller: Intel Corporation 9 Series Chipset Family USB xHCI Controller
00:16.0 Communication controller: Intel Corporation 9 Series Chipset Family ME Interface #1
00:19.0 Ethernet controller: Intel Corporation Ethernet Connection (2) I218-V
00:1a.0 USB controller: Intel Corporation 9 Series Chipset Family USB EHCI Controller #2
00:1b.0 Audio device: Intel Corporation 9 Series Chipset Family HD Audio Controller
00:1c.0 PCI bridge: Intel Corporation 9 Series Chipset Family PCI Express Root Port 1 (rev d0)
00:1c.3 PCI bridge: Intel Corporation 82801 PCI Bridge (rev d0)
00:1c.4 PCI bridge: Intel Corporation 9 Series Chipset Family PCI Express Root Port 5 (rev d0)
00:1d.0 USB controller: Intel Corporation 9 Series Chipset Family USB EHCI Controller #1
00:1f.0 ISA bridge: Intel Corporation 9 Series Chipset Family Z97 LPC Controller
00:1f.2 SATA controller: Intel Corporation 9 Series Chipset Family SATA Controller [AHCI Mode]
00:1f.3 SMBus: Intel Corporation 9 Series Chipset Family SMBus Controller
03:00.0 PCI bridge: ASMedia Technology Inc. ASM1083/1085 PCIe to PCI Bridge (rev 04)
05:00.0 VGA compatible controller: NVIDIA Corporation G86 [GeForce 8500 GT] (rev a1)

# atraves do comando "lspci -v" eh possivel visualizar o nome do fabricante, I/O Port
# utilizada, IRQ utilizada, o drive do kernel utilizado e o Bus utilizado. 
#
00:00.0 Host bridge: Intel Corporation 4th Gen Core Processor DRAM Controller (rev 06)
	Subsystem: ASUSTeK Computer Inc. Device 8534
	Flags: bus master, fast devsel, latency 0
	Capabilities: [e0] Vendor Specific Information: Len=0c <?>
	Kernel driver in use: hsw_uncore

00:19.0 Ethernet controller: Intel Corporation Ethernet Connection (2) I218-V
	Subsystem: ASUSTeK Computer Inc. Device 85c4
	Flags: bus master, fast devsel, latency 0, IRQ 41
	Memory at f7100000 (32-bit, non-prefetchable) [size=128K]
	Memory at f7138000 (32-bit, non-prefetchable) [size=4K]
	I/O ports at f040 [size=32]
	Capabilities: [c8] Power Management version 2
	Capabilities: [d0] MSI: Enable+ Count=1/1 Maskable- 64bit+
	Capabilities: [e0] PCI Advanced Features
	Kernel driver in use: e1000e

00:1b.0 Audio device: Intel Corporation 9 Series Chipset Family HD Audio Controller
	Subsystem: ASUSTeK Computer Inc. Device 8630
	Flags: bus master, fast devsel, latency 0, IRQ 45
	Memory at f7130000 (64-bit, non-prefetchable) [size=16K]
	Capabilities: [50] Power Management version 2
	Capabilities: [60] MSI: Enable+ Count=1/1 Maskable- 64bit+
	Capabilities: [70] Express Root Complex Integrated Endpoint, MSI 00
	Capabilities: [100] Virtual Channel
	Kernel driver in use: snd_hda_intel

00:1f.2 SATA controller: Intel Corporation 9 Series Chipset Family SATA Controller [AHCI Mode] (prog-if 01 [AHCI 1.0])
	Subsystem: ASUSTeK Computer Inc. Device 8534
	Flags: bus master, 66MHz, medium devsel, latency 0, IRQ 42
	I/O ports at f090 [size=8]
	I/O ports at f080 [size=4]
	I/O ports at f070 [size=8]
	I/O ports at f060 [size=4]
	I/O ports at f020 [size=32]
	Memory at f7135000 (32-bit, non-prefetchable) [size=2K]
	Capabilities: [80] MSI: Enable+ Count=1/1 Maskable- 64bit-
	Capabilities: [70] Power Management version 3
	Capabilities: [a8] SATA HBA v1.0
	Kernel driver in use: ahci

03:00.0 PCI bridge: ASMedia Technology Inc. ASM1083/1085 PCIe to PCI Bridge (rev 04) (prog-if 01 [Subtractive decode])
	Flags: bus master, fast devsel, latency 0
	Bus: primary=03, secondary=04, subordinate=04, sec-latency=32
	Capabilities: [c0] Subsystem: ASUSTeK Computer Inc. Device 8489

######
#
# LSUSB
#
#####
#
# atraves do aplicativo LSUSB, eh possivel identificar quais dispositivos
# usb estao conectados no computador. No exemplo abaixo, temos um mouse
# conectado na porta usb. Alem disso, eh possivel identificar quantas portas
# usb o computador possui, root usb.

# sem nenhum parametro extra, eh possivel obter informacoes de forma
# resumida dos dispositivos usb que stao conectados no computador, vide
# exemplo abaixo.
#
Bus 002 Device 002: ID 8087:8001 Intel Corp. 
Bus 002 Device 001: ID 1d6b:0002 Linux Foundation 2.0 root hub
Bus 001 Device 002: ID 8087:8009 Intel Corp. 
Bus 001 Device 001: ID 1d6b:0002 Linux Foundation 2.0 root hub
Bus 004 Device 001: ID 1d6b:0003 Linux Foundation 3.0 root hub
Bus 003 Device 002: ID 045e:0083 Microsoft Corp. Basic Optical Mouse
Bus 003 Device 001: ID 1d6b:0002 Linux Foundation 2.0 root hub

# atraves da opcao -v, lsusb -v, eh possivel obter mais informacoes sobre
# os dispositivos usb que estao conectados no computador.
#
# mouse usb
#
Bus 003 Device 002: ID 045e:0083 Microsoft Corp. Basic Optical Mouse
Device Descriptor:
  bLength                18
  bDescriptorType         1
  bcdUSB               1.10
  bDeviceClass            0 (Defined at Interface level)
  bDeviceSubClass         0 
  bDeviceProtocol         0 
  bMaxPacketSize0         8
  idVendor           0x045e Microsoft Corp.
  idProduct          0x0083 Basic Optical Mouse
  bcdDevice            0.00
  iManufacturer           1 
  iProduct                2 
  iSerial                 0 
  bNumConfigurations      1
  Configuration Descriptor:
    bLength                 9
    bDescriptorType         2
    wTotalLength           34
    bNumInterfaces          1
    bConfigurationValue     1
    iConfiguration          0 
    bmAttributes         0xa0
      (Bus Powered)
      Remote Wakeup
    MaxPower              100mA
    Interface Descriptor:
      bLength                 9
      bDescriptorType         4
      bInterfaceNumber        0
      bAlternateSetting       0
      bNumEndpoints           1
      bInterfaceClass         3 Human Interface Device
      bInterfaceSubClass      1 Boot Interface Subclass
      bInterfaceProtocol      2 Mouse
      iInterface              0 
        HID Device Descriptor:
          bLength                 9
          bDescriptorType        33
          bcdHID               1.10
          bCountryCode            0 Not supported
          bNumDescriptors         1
          bDescriptorType        34 Report
          wDescriptorLength      52
         Report Descriptors: 
           ** UNAVAILABLE **
      Endpoint Descriptor:
        bLength                 7
        bDescriptorType         5
        bEndpointAddress     0x81  EP 1 IN
        bmAttributes            3
          Transfer Type            Interrupt
          Synch Type               None
          Usage Type               Data
        wMaxPacketSize     0x0004  1x 4 bytes
        bInterval              10

# porta usb versao 2.0
#
Bus 003 Device 001: ID 1d6b:0002 Linux Foundation 2.0 root hub
Device Descriptor:
  bLength                18
  bDescriptorType         1
  bcdUSB               2.00
  bDeviceClass            9 Hub
  bDeviceSubClass         0 Unused
  bDeviceProtocol         1 Single TT
  bMaxPacketSize0        64
  idVendor           0x1d6b Linux Foundation
  idProduct          0x0002 2.0 root hub
  bcdDevice            3.16
  iManufacturer           3 
  iProduct                2 
  iSerial                 1 
  bNumConfigurations      1
  Configuration Descriptor:
    bLength                 9
    bDescriptorType         2
    wTotalLength           25
    bNumInterfaces          1
    bConfigurationValue     1
    iConfiguration          0 
    bmAttributes         0xe0
      Self Powered
      Remote Wakeup
    MaxPower                0mA
    Interface Descriptor:
      bLength                 9
      bDescriptorType         4
      bInterfaceNumber        0
      bAlternateSetting       0
      bNumEndpoints           1
      bInterfaceClass         9 Hub
      bInterfaceSubClass      0 Unused
      bInterfaceProtocol      0 Full speed (or root) hub
      iInterface              0 
      Endpoint Descriptor:
        bLength                 7
        bDescriptorType         5
        bEndpointAddress     0x81  EP 1 IN
        bmAttributes            3
          Transfer Type            Interrupt
          Synch Type               None
          Usage Type               Data
        wMaxPacketSize     0x0004  1x 4 bytes
        bInterval              12

# porta usb versao 3.0
#
Bus 004 Device 001: ID 1d6b:0003 Linux Foundation 3.0 root hub
Device Descriptor:
  bLength                18
  bDescriptorType         1
  bcdUSB               3.00
  bDeviceClass            9 Hub
  bDeviceSubClass         0 Unused
  bDeviceProtocol         3 
  bMaxPacketSize0         9
  idVendor           0x1d6b Linux Foundation
  idProduct          0x0003 3.0 root hub
  bcdDevice            3.16
  iManufacturer           3 
  iProduct                2 
  iSerial                 1 
  bNumConfigurations      1
  Configuration Descriptor:
    bLength                 9
    bDescriptorType         2
    wTotalLength           31
    bNumInterfaces          1
    bConfigurationValue     1
    iConfiguration          0 
    bmAttributes         0xe0
      Self Powered
      Remote Wakeup
    MaxPower                0mA
    Interface Descriptor:
      bLength                 9
      bDescriptorType         4
      bInterfaceNumber        0
      bAlternateSetting       0
      bNumEndpoints           1
      bInterfaceClass         9 Hub
      bInterfaceSubClass      0 Unused
      bInterfaceProtocol      0 Full speed (or root) hub
      iInterface              0 
      Endpoint Descriptor:
        bLength                 7
        bDescriptorType         5
        bEndpointAddress     0x81  EP 1 IN
        bmAttributes            3
          Transfer Type            Interrupt
          Synch Type               None
          Usage Type               Data
        wMaxPacketSize     0x0004  1x 4 bytes
        bInterval              12
        bMaxBurst               0
